comment_number,comment
0,Real link did not work.  See my earlier comments.
1,The combination of panel discussion and practical application was excellent.
2,You didn't give more time for panelists to answer online questions. May sahre with us if those were dealt with.
3,"Je trouve que lorsque nous avons une présentation traduite, cela change beaucoup la dynamique. Ils font un très bon travail, mais le ""ton"" ne reflète pas l'interlocuteur alors cela rend la présentation plus monotone."
4,La webdiffusion à mon site (Centre de recherche de Valcartier QC) coupait sans arrêt ce qui rendait impossible de suivre l'événement. J'ai dû utiliser la téléconférence (audio seulement via ligne téléphonique).
5,In my case it would be a huge learning curve for the implementation of any AI.
6,"I don't know what I don't know. It seems like the process can be quick, but unfortunately experience dictates otherwise. I am nonetheless optimistic and look forward to going through it."
7,We need more events on this subject and maybe more detailed and technical for non-specialist employees
8,
